{
  "schema": "wlv-run-manifest",
  "schema_version": "1",
  "run_id": "run-fixture-v1",
  "result_id": "9d6ec48029f2fd3ad977e954501e79baeb265007c37d0ca26567c55a6d9da12d",
  "created_at_utc": "2026-08-20T12:00:01Z",
  "parent_run_id": null,
  "method": "example",
  "output_contract": {
    "id": "wlvpanel-output",
    "version": "1.0.0"
  },
  "result": {
    "provenance": {
      "fixture": {
        "language": "pt-BR",
        "shared": true
      }
    }
  },
  "execution": {
    "started_at_utc": "2026-08-20T12:00:00Z",
    "finished_at_utc": "2026-08-20T12:00:01Z",
    "duration_seconds": 1,
    "warnings": []
  },
  "artifacts": [
    {
      "path": "payload.txt",
      "role": "test-payload",
      "size_bytes": 50,
      "sha256": "ccc2efdb523a706ad57d2c4d85cd7ab8755dae194fad89ca86d2511f468612a7"
    }
  ]
}
